media,date,ranking,title,url,words
nikkei,2022-12-17,1,変わる「駅まで10分」、マンション広告も消費者意識も,https://www.nikkei.com/article/DGXZQOUC0550M0V01C22A2000000/,駅 10分 マンション広告 消費者意識
nikkei,2022-12-17,2,NTTドコモ、ボクシング井上尚弥戦「無料開放」の誤算,https://www.nikkei.com/article/DGXZQOUC147090U2A211C2000000/,NTTドコモ ボクシング井上尚弥戦 無料開放 誤算
nikkei,2022-12-17,3,病気ごとに危険な時間帯 がんとの闘いは「明け方有利」,https://www.nikkei.com/article/DGXZQOUC128IJ0S2A211C2000000/,病気ごと 危険 時間帯 がん 闘い 明け方有利
nikkei,2022-12-17,4,NISA、生涯投資枠1800万円 非課税期間を無期限に,https://www.nikkei.com/article/DGXZQOUA0523Q0V01C22A2000000/,NISA 生涯投資枠1800万円 非課税期間 期限
nikkei,2022-12-17,5,風呂なし物件、若者捉える ドアの外はふれあいの街 シンプルライフ築く礎に,https://www.nikkei.com/article/DGKKZO66935740X11C22A2MM0000/,風呂 物件 若者 ドア 外 街 シンプルライフ 礎
nikkei,2022-12-17,6,ゴールドマン、4000人規模の人員削減検討 投資銀不振で,https://www.nikkei.com/article/DGXZQOGN16EEA0W2A211C2000000/,ゴールドマン 4000人規模 人員削減検討 投資銀不振
nikkei,2022-12-17,7,政府、日銀との共同声明見直し論 物価目標で慎重意見も,https://www.nikkei.com/article/DGXZQOUB172NM0X11C22A2000000/,政府 日銀 共同声明見直し論 物価目標 慎重意見
nikkei,2022-12-17,8,帰ってきた「うる星やつら」 80～90年代アニメ復活続々,https://www.nikkei.com/article/DGXZQOUC215J30R21C22A1000000/,星やつら 80～90年代アニメ復活
nikkei,2022-12-17,9,最大級ミサイル攻撃、ウクライナ大統領「反撃の決意」,https://www.nikkei.com/article/DGXZQOGR170F80X11C22A2000000/,最大級ミサイル攻撃 ウクライナ大統領 反撃 決意
nikkei,2022-12-17,10,ルネサス、北京の工場停止 新型コロナ感染拡大で,https://www.nikkei.com/article/DGXZQOUC172QA0X11C22A2000000/,ルネサス 北京 工場停止 新型コロナ感染拡大
nikkei,2022-12-17,11,サッカーW杯、ABEMA配信活況 桁違いの視聴者数,https://www.nikkei.com/article/DGXZQODH15CE90V11C22A2000000/,サッカーW杯 ABEMA配信活況 桁違い 視聴者数
nikkei,2022-12-17,12,メッシ戴冠か、フランス3カ国目の連覇か 19日未明決勝,https://www.nikkei.com/article/DGXZQODH16DQ60W2A211C2000000/,メッシ戴冠 フランス3カ国目 連覇 19日未明決勝
nikkei,2022-12-17,13,風呂なし物件、若者捉える シンプルライフ築く礎に,https://www.nikkei.com/article/DGXZQOUB085HC0Y2A201C2000000/,風呂 物件 若者 シンプルライフ 礎
nikkei,2022-12-17,14,ウクライナ各地にミサイル攻撃 電力50%喪失,https://www.nikkei.com/article/DGXZQOGR16EAJ0W2A211C2000000/,ウクライナ各地 ミサイル攻撃 電力50%喪失
nikkei,2022-12-17,15,（ウォール街ラウンドアップ）FRBは本当にタカ派か,https://www.nikkei.com/article/DGKKZO66933790X11C22A2ENI000/,ウォール街ラウンドアップ FRB タカ派
nikkei,2022-12-17,16,ロシア軍、ミサイル数十発 ウクライナ、電力消費半減,https://www.nikkei.com/article/DGKKZO66935630X11C22A2MM0000/,ロシア軍 ミサイル数十発 ウクライナ 電力消費半減
nikkei,2022-12-17,17,Twitter、マスク氏担当記者らのアカウント凍結解除,https://www.nikkei.com/article/DGXZQOGN171WM0X11C22A2000000/,Twitter マスク氏担当記者ら アカウント凍結解除
nikkei,2022-12-17,18,薗浦議員、秘書と共謀認める意向 地検が略式起訴検討,https://www.nikkei.com/article/DGXZQOUE1710P0X11C22A2000000/,薗浦議員 秘書 共謀 意向 地検 略式起訴検討
nikkei,2022-12-17,19,都内のイルミネーション、再エネでサステナブルに,https://www.nikkei.com/article/DGXZQOFH136U20T11C22A2000000/,都内 イルミネーション エネ サステナブル
nikkei,2022-12-17,20,NISA恒久化、非課税無期限に 貯蓄から投資後押し 与党税制大綱を決定,https://www.nikkei.com/article/DGKKZO66931810X11C22A2MM8000/,NISA恒久化 非課税 期限 貯蓄 投資後押し 与党税制大綱 決定
nikkei,2022-12-17,21,NISA「人生100年」仕様に 最大1800万円まで、引き出しも可 18歳未満参加に課題,https://www.nikkei.com/article/DGKKZO66930800W2A211C2EA4000/,NISA 人生100年 仕様 最大1800万円 可 18歳未満参加 課題
nikkei,2022-12-17,22,ふるさと納税を使い切る 上限を確認、サイトの還元も,https://www.nikkei.com/article/DGXZQOUB122O20S2A211C2000000/,ふるさと納税 上限 確認 サイト 還元
nikkei,2022-12-17,23,（あすへの話題）死ぬまでに見たいもの ピアニスト 仲道郁代,https://www.nikkei.com/article/DGKKZO66936010X11C22A2MM0000/,あす 話題 ピアニスト 仲道郁代
nikkei,2022-12-17,24,（オフナビ）個性際立つ「本屋さん」,https://www.nikkei.com/article/DGKKZO66933470X11C22A2KNTP00/,オフナビ 個性 本屋さん
nikkei,2022-12-17,25,（データが奏でる主旋律）（カタールW杯・データが奏でる主旋律）ボールは持たせて勝つ フランス、堅守モロッコ乱す 決勝、「持たざる戦い」か,https://www.nikkei.com/article/DGKKZO66935320X11C22A2UU0000/,データ 旋律 カタールW杯 データ 旋律 ボール フランス 堅守モロッコ 決勝 戦い
nikkei,2022-12-17,26,EV用電池倉庫、規制緩和へ 消火設備条件に制限なくす,https://www.nikkei.com/article/DGXZQOUA033FR0T01C22A1000000/,EV用電池倉庫 規制緩和 消火設備条件 制限
nikkei,2022-12-17,27,日本法人売却、FTXが申請 承認なら入札実施へ,https://www.nikkei.com/article/DGKKZO66935940X11C22A2MM0000/,日本法人売却 FTX 申請 承認 入札実施
nikkei,2022-12-17,28,NY株続落、終値281ドル安,https://www.nikkei.com/article/DGKKZO66936140X11C22A2MM0000/,NY株続落 終値281ドル安
nikkei,2022-12-17,29,岸田首相、バイデン大統領に防衛力説明へ 1月にも訪米,https://www.nikkei.com/article/DGXZQOUA163KB0W2A211C2000000/,岸田首相 バイデン大統領 防衛力説明 1月 訪米
nikkei,2022-12-17,30,［社説］大幅に拡充するNISAの活用を促そう,https://www.nikkei.com/article/DGXZQODK167IH0W2A211C2000000/,社説 大幅 拡充 NISA 活用
